{
  "id": "source-rappelconso-guigoz-bacillus-cereus-2025",
  "title": "RappelConso — Guigoz Optipro Relais 1, fiche 2025-12-0088 version 1",
  "publisher": "RappelConso — DGAL / DGCCRF",
  "url": "https://rappel.conso.gouv.fr/fiche-rappel/20759/Interne",
  "source_type": "database",
  "published_at": "2025-12-11",
  "accessed_at": "2026-10-30",
  "language": "fr",
  "methodology": "Fiche officielle de rappel publiée le 11 décembre 2025. Elle identifie un lot de Guigoz Optipro Relais 1, son GTIN, numéro de lot, DDM, zones de distribution et consignes transmises par le professionnel.",
  "potential_conflicts": "Les informations produit et le motif sont transmis par Nestlé France, entreprise à l'origine du rappel ; la fiche est hébergée par le service public RappelConso.",
  "limitations": "Rappel volontaire et préventif portant sur un lot précis pour risque de présence de Bacillus cereus. Il s'agit d'un événement distinct des rappels de 2026 concernant la céréulide et une huile ARA. Ne pas confondre les agents, lots et dates.",
  "review_status": "to_review"
}
