{
  "id": "source-nestle-recall-faq-2026",
  "title": "Rappel volontaire et préventif des laits infantiles Guigoz et Nidal — FAQ mise à jour",
  "publisher": "Nestlé France",
  "url": "https://www.nestle.fr/ask-nestle/answers/rappel-guigoz-nidal",
  "source_type": "official_statement",
  "published_at": "2026-05-29",
  "accessed_at": "2026-10-30",
  "language": "fr",
  "potential_conflicts": "Communication de l'entreprise concernée par les rappels ; source primaire pour la position de Nestlé, non indépendante.",
  "methodology": "FAQ de Nestlé mise à jour le 29 mai 2026, comprenant une chronologie des rappels, les mesures correctives annoncées et les suites des enquêtes sur deux décès de nourrissons.",
  "limitations": "Les déclarations relatives aux mesures internes et à la sécurité des lots actuels sont des affirmations de l'entreprise. Les suites judiciaires doivent être confrontées aux déclarations des parquets et à des sources indépendantes.",
  "review_status": "to_review"
}
