{
  "id": "source-fr-economy-shein-marketplace-2026",
  "title": "Vente de produits dangereux et contenus illicites : le point sur les procédures engagées contre Shein",
  "publisher": "Ministère français de l'Économie",
  "url": "https://www.economie.gouv.fr/actualites/vente-de-produits-dangereux-et-contenus-illicites-le-point-sur-les-procedures-engagees-contre-shein",
  "source_type": "official_statement",
  "published_at": "2026-03-20",
  "accessed_at": "2026-10-30",
  "language": "fr",
  "methodology": "Point officiel sur les investigations de la DGCCRF, les procédures judiciaires et une opération douanière de contrôle de colis SHEIN à Roissy le 6 novembre 2025.",
  "limitations": "Le taux de huit articles non conformes sur dix se rapporte à cette opération de contrôle et ne constitue pas une estimation de l'ensemble du catalogue SHEIN. Les procédures et signalements ne valent pas condamnation définitive.",
  "review_status": "to_review"
}
