{
  "id": "source-afp-angers-infant-death-cereulide-2026",
  "title": "Le lait contaminé hors de cause dans la mort d'un bébé à Angers",
  "publisher": "Agence France-Presse / Boursorama",
  "url": "https://www.boursorama.com/actualite-economique/actualites/le-lait-contamine-hors-de-cause-dans-la-mort-d-un-bebe-a-angers-8350379c5db27f46ce83319bc10a3276",
  "source_type": "journalism",
  "published_at": "2026-05-06",
  "accessed_at": "2026-10-30",
  "language": "fr",
  "methodology": "Dépêche AFP rapportant les déclarations du procureur d'Angers après les analyses dans l'enquête sur le décès d'un nourrisson de 27 jours.",
  "limitations": "La dépêche rapporte que le parquet écarte le lien entre le lait et le décès et privilégie une hypothèse d'asphyxie ; elle ne constitue pas un jugement définitif sur l'ensemble des rappels ou des autres signalements.",
  "review_status": "to_review"
}
