{
  "id": "source-nestle-baby-food-plastic-packaging-response-2026",
  "title": "Baby food plastic packaging: Our response",
  "publisher": "Nestlé Global",
  "url": "https://www.nestle.com/ask-nestle/environment/answers/baby-food-plastic-packaging",
  "source_type": "official_statement",
  "published_at": null,
  "accessed_at": "2026-10-30",
  "language": "en",
  "methodology": "Page officielle de questions-réponses de Nestlé consacrée aux emballages plastiques des aliments pour bébés et aux préoccupations soulevées par les rapports sur les microplastiques.",
  "potential_conflicts": "Déclaration de l'entreprise directement concernée ; il s'agit de la position de Nestlé, et non d'une expertise indépendante.",
  "limitations": "La page affirme que les produits Nestlé sont sûrs et conformes aux réglementations, décrit des contrôles et une veille scientifique, mais ne publie pas sur cette page de résultats analytiques propres aux trois sachets Gerber étudiés par SINTEF Ocean. Aucune date de publication n'est affichée.",
  "review_status": "to_review"
}
