{
  "id": "source-fda-microplastics-food-guidance-2026",
  "title": "Microplastics and Nanoplastics in Foods",
  "publisher": "U.S. Food and Drug Administration (FDA)",
  "url": "https://www.fda.gov/food/environmental-contaminants-food/microplastics-and-nanoplastics-foods",
  "source_type": "official_statement",
  "published_at": null,
  "accessed_at": "2026-10-30",
  "language": "en",
  "methodology": "Page d'information institutionnelle présentant l'état des connaissances, les limites méthodologiques, les questions de migration depuis les emballages et l'évaluation des risques sanitaires liés aux microplastiques et nanoplastiques dans les aliments.",
  "potential_conflicts": "Autorité réglementaire américaine ; la page décrit la position et les travaux de la FDA.",
  "limitations": "Cette page générale ne porte pas sur les sachets Gerber analysés par SINTEF Ocean et ne constitue pas une analyse indépendante de ces échantillons. Elle reflète l'état des connaissances présenté par la FDA à la date de consultation.",
  "review_status": "to_review"
}
