{
  "id": "source-nestle-response-radiofrance-2026",
  "title": "Réaction de Nestlé France aux informations relayées par Radio France sur le rappel de laits infantiles",
  "publisher": "Nestlé France",
  "url": "https://www.nestle.fr/media/pressreleases/nestle-reponse-radiofrance",
  "source_type": "official_statement",
  "published_at": "2026-05-19",
  "accessed_at": "2026-10-30",
  "language": "fr",
  "potential_conflicts": "Déclaration de l'entreprise directement concernée par la controverse ; source primaire pour sa position et sa chronologie, non indépendante.",
  "methodology": "Communiqué de Nestlé France publié le 19 mai 2026 en réponse à l'enquête de Radio France. Il décrit les contrôles, l'information du secteur, les notifications pays par pays et les rappels publics selon la version de l'entreprise.",
  "limitations": "Nestlé conteste les allégations de retraits discrets et de retard. Ce communiqué présente la version de l'entreprise et doit être confronté au compte rendu parlementaire, aux enquêtes journalistiques et aux communications des autorités.",
  "review_status": "to_review"
}
