{
  "id": "source-atni-bms-index-2024-nestle",
  "title": "BMS Index 2024 — fiche Nestlé",
  "publisher": "Access to Nutrition Initiative (ATNi)",
  "url": "https://accesstonutrition.org/index/bms-index-2024/scorecards/nestle-8/",
  "source_type": "ngo_report",
  "published_at": null,
  "accessed_at": "2026-10-30",
  "language": "en",
  "methodology": "Évaluation des politiques et pratiques de commercialisation des substituts du lait maternel selon le Code international de l'OMS. Pour Nestlé, l'étude couvre cinq marchés (Chine, Allemagne, Indonésie, États-Unis et Viet Nam) et plusieurs canaux : médias en ligne et traditionnels, commerce en ligne et étiquetage des produits.",
  "potential_conflicts": "ATNi indique que ses travaux sont financés par des donateurs, dont la Bill & Melinda Gates Foundation, et qu'il n'accepte pas de financement, dons ou parrainage de l'industrie agroalimentaire. Les données de terrain s'appuient notamment sur des prestataires et bases de données sous licence.",
  "limitations": "L'étude évalue l'alignement sur le Code international de l'OMS et les orientations associées, pas le respect des lois nationales. Les cinq pays étudiés ne représentent pas tous les marchés de Nestlé. ATNi précise que la collecte et le niveau d'engagement des entreprises peuvent limiter l'exhaustivité des résultats. Les incidences recensées ne doivent pas être présentées comme des infractions judiciairement constatées.",
  "review_status": "to_review"
}
