{
  "id": "source-nestle-non-financial-statement-2024-bms",
  "title": "Non-Financial Statement 2024 — commercialisation des substituts du lait maternel",
  "publisher": "Nestlé S.A.",
  "url": "https://www.nestle.fr/sites/g/files/pydnoa566/files/2025-04/non-financial-statement-2024.pdf",
  "source_type": "official_statement",
  "accessed_at": "2026-10-30",
  "language": "en",
  "methodology": "Déclaration extra-financière annuelle publiée par Nestlé. Les chiffres sur les cas de non-conformité proviennent des systèmes internes de suivi, des audits et des mécanismes de signalement de l'entreprise.",
  "potential_conflicts": "Source produite par l'entreprise évaluée ; elle est primaire pour connaître sa propre position et ses chiffres déclarés, mais ne constitue pas une évaluation indépendante.",
  "limitations": "Nestlé mesure les cas au regard de sa propre politique et de la réglementation locale, tandis qu'ATNi évalue les pratiques par rapport au Code international de l'OMS et à ses orientations. Les deux comptages ont donc des périmètres et critères différents et ne sont pas directement comparables.",
  "review_status": "to_review"
}
