{
  "id": "source-swissinfo-nestle-vosges-cassation-2026",
  "title": "Décharges sauvages en France : Nestlé s'est pourvu en cassation",
  "publisher": "SWI swissinfo.ch / Keystone-ATS",
  "url": "https://www.swissinfo.ch/fre/d%C3%A9charges-sauvages-en-france%3A-nestl%C3%A9-s%27est-pourvu-en-cassation/92187554",
  "source_type": "journalism",
  "published_at": "2026-10-08",
  "accessed_at": "2026-10-30",
  "language": "fr",
  "methodology": "Dépêche Keystone-ATS du 8 octobre 2026 rapportant le pourvoi en cassation de Nestlé contre l'arrêt de la cour d'appel de Nancy du 17 septembre 2026 et le report de la décision du tribunal correctionnel.",
  "limitations": "Le pourvoi en cassation ne préjuge pas de l'issue. L'article indique que l'effet du pourvoi dépend de la décision de la Cour de cassation ; la procédure des décharges plastiques reste distincte de la CJIPE de 2024.",
  "review_status": "to_review"
}
