{
  "id": "source-afp-nestle-vosges-dumps-retrial-2026",
  "title": "Décharges Nestlé : la justice se prononce sur les expertises annulées",
  "publisher": "Agence France-Presse / Boursorama",
  "url": "https://www.boursorama.com/bourse/actualites/decharges-nestle-la-justice-se-prononce-sur-les-expertises-annulees-910da7f317d0bd0d51bc3f4b0dbaffcc",
  "source_type": "journalism",
  "published_at": "2026-09-17",
  "accessed_at": "2026-10-30",
  "language": "fr",
  "methodology": "Dépêche AFP rapportant la décision de la cour d'appel de Nancy de renvoyer l'affaire devant un tribunal correctionnel recomposé et de réintégrer des expertises écartées au premier procès.",
  "limitations": "La décision porte sur la procédure et l'admissibilité d'éléments d'expertise ; elle ne constitue pas une déclaration de culpabilité ni une décision définitive sur les faits reprochés. Les accusations et les analyses contestées doivent être attribuées à leurs auteurs.",
  "review_status": "to_review"
}
