{
  "id": "source-nestle-cocoa-plan",
  "title": "Approvisionnement en cacao — programmes de suivi du travail des enfants",
  "publisher": "Nestlé France",
  "url": "https://www.nestle.fr/developpement-durable/approvisionnement-durable/cacao",
  "source_type": "official_statement",
  "accessed_at": "2026-10-30",
  "language": "fr",
  "potential_conflicts": "Présentation par l'entreprise de son propre programme d'approvisionnement et de prévention du travail des enfants.",
  "methodology": "Page institutionnelle décrivant les programmes de Nestlé, notamment son système de suivi et de remédiation du travail des enfants (CLMRS) développé avec l'International Cocoa Initiative.",
  "limitations": "Décrit les engagements et dispositifs revendiqués par l'entreprise ; ne constitue pas une évaluation indépendante de leur efficacité ou de leur couverture actuelle.",
  "review_status": "to_review"
}
