{
  "id": "source-justice-2024-cjipe-nestle",
  "title": "Convention judiciaire d'intérêt public environnementale — Nestlé Waters Supply Est, 2 septembre 2024",
  "publisher": "Ministère de la Justice / Parquet d'Épinal",
  "url": "https://www.justice.gouv.fr/sites/default/files/2024-09/CJIPE_Nestle_Waters_20240902.pdf",
  "source_type": "primary_document",
  "published_at": "2024-09-02",
  "accessed_at": "2026-10-30",
  "language": "fr",
  "methodology": "Convention judiciaire d'intérêt public en matière environnementale publiée par le ministère de la Justice.",
  "limitations": "La convention concerne Nestlé Waters Supply Est et les faits relevant de son périmètre dans les Vosges. Ne pas extrapoler ses dispositions à toutes les filiales, marques ou activités du groupe.",
  "review_status": "to_review"
}
