{
  "id": "source-nestle-bms-policy-2024",
  "title": "Upholding responsible marketing: Nestlé Leading the Way report",
  "publisher": "Nestlé",
  "url": "https://www.nestle.com/media/news/breast-milk-substitutes-who-code-compliance-report-2023",
  "source_type": "official_statement",
  "published_at": "2024-08-16",
  "accessed_at": "2026-10-30",
  "language": "en",
  "potential_conflicts": "Publication by the company about its own policy and compliance programme.",
  "methodology": "Company statement accompanying Nestlé's own report on its implementation of its policy for marketing breast-milk substitutes.",
  "limitations": "This source documents Nestlé's stated policies and monitoring systems; it is not an independent assessment of actual marketing practices.",
  "review_status": "to_review"
}
