{
  "id": "source-senat-shein-dgccrf-2026",
  "title": "État de l'enquête de la DGCCRF sur la société Shein — réponse ministérielle du 10 septembre 2026",
  "publisher": "Sénat / Ministère des PME, du Commerce, de l'Artisanat, du Tourisme et du Pouvoir d'achat",
  "url": "https://www.senat.fr/questions/base/2025/qSEQ250504709.html",
  "source_type": "primary_document",
  "published_at": "2026-09-10",
  "accessed_at": "2026-10-30",
  "language": "fr",
  "methodology": "Réponse ministérielle publiée au Journal officiel en réponse à une question écrite parlementaire. Elle rapporte les conclusions de la DGCCRF et les sanctions administratives prononcées.",
  "limitations": "Il faut lire la réponse ministérielle publiée le 10 septembre 2026, et non attribuer au Gouvernement les seuls soupçons formulés dans la question initiale. Les pourcentages portent sur les annonces de réduction contrôlées ; ils ne décrivent pas toutes les annonces de la plateforme.",
  "review_status": "to_review"
}
