{
  "id": "source-uk-parliament-shein-cotton-hearing-2025",
  "title": "Business and Trade Committee — Oral evidence: Make Work Pay, Employment Rights Bill, 7 January 2025",
  "publisher": "House of Commons — Business and Trade Committee",
  "url": "https://committees.parliament.uk/oralevidence/15200/html/",
  "source_type": "primary_document",
  "published_at": "2025-01-07",
  "accessed_at": "2026-10-30",
  "language": "en",
  "methodology": "Transcription officielle de l'audition de Yinan Zhu, directrice juridique EMEA de SHEIN, devant la commission parlementaire britannique ; questions sur l'origine du coton, le Xinjiang, le travail forcé et les audits fournisseurs.",
  "limitations": "Le fait qu'une représentante n'ait pas répondu à une question pendant l'audition ne prouve pas que des produits SHEIN contiennent du coton du Xinjiang ou proviennent du travail forcé. Il faut lire la lettre de suivi du comité qui reprend la réponse écrite de l'entreprise.",
  "review_status": "to_review"
}
