{
  "id": "source-fla-cocoa-cameroon-2022",
  "title": "Baseline Assessment: Mapping working conditions and child labor in Nestlé's cocoa supply chain in Cameroon",
  "publisher": "Fair Labor Association",
  "url": "https://www.fairlabor.org/reports/mapping-working-conditions-and-child-labor-in-nestles-cocoa-supply-chain-in-cameroon/",
  "source_type": "ngo_report",
  "published_at": "2022-05-16",
  "accessed_at": "2026-10-30",
  "language": "en",
  "methodology": "Baseline assessment conducted in March and April 2020 across three cooperatives and six cocoa-producing communities supplying a Nestlé tier-1 supplier; interviews, farm visits and review of supplier systems.",
  "limitations": "Historical and geographically limited assessment. The FLA states it did not encounter child labour on the farms visited, while identifying risk indicators and monitoring gaps. Nestlé ended its membership as an FLA Participating Company in April 2025; this does not by itself establish the current status of all monitoring systems.",
  "review_status": "to_review"
}
