{
  "id": "source-senat-2025-enquete-eaux-minerales",
  "title": "Eaux minérales naturelles : préserver la pureté — rapport n° 628 (2024-2025), tome I",
  "publisher": "Sénat — Commission d'enquête sur les pratiques des industriels de l'eau en bouteille",
  "url": "https://www.senat.fr/rap/r24-628-1/r24-628-1.html",
  "source_type": "primary_document",
  "published_at": "2025-05-14",
  "accessed_at": "2026-10-30",
  "language": "fr",
  "methodology": "Rapport d'une commission d'enquête parlementaire, fondé notamment sur des auditions, documents administratifs et travaux de contrôle. Les conclusions et appréciations sont attribuées à la commission.",
  "limitations": "Un rapport parlementaire n'est pas un jugement judiciaire. Les formulations relatives aux pressions, aux intentions et à l'interprétation des règles doivent rester attribuées au rapport et être lues avec les réponses de l'entreprise et les documents judiciaires.",
  "review_status": "to_review"
}
