{
  "id": "source-uk-parliament-shein-cotton-letter-2025",
  "title": "Business and Trade Committee letter to SHEIN on supplier locations and human-rights due diligence, 27 January 2025",
  "publisher": "House of Commons — Business and Trade Committee",
  "url": "https://committees.parliament.uk/publications/46394/documents/234811/default/",
  "source_type": "primary_document",
  "published_at": "2025-01-27",
  "accessed_at": "2026-10-30",
  "language": "en",
  "methodology": "Lettre officielle du président de la commission à SHEIN résumant les réponses écrites reçues de l'entreprise après l'audition du 7 janvier 2025.",
  "limitations": "La lettre rapporte la position écrite de SHEIN telle que comprise par la commission ; elle ne vérifie pas indépendamment l'origine du coton ni l'efficacité des systèmes de traçabilité et d'audit.",
  "review_status": "to_review"
}
